{
  "id": "sync-compliance-neo4j-2026-03-15",
  "direction": "export",
  "target_system": "neo4j",
  "payload_type": "compliance-report",
  "payload": {
    "id": "cr-ix-default-2026-03-15",
    "repo": "ix",
    "agent": "default",
    "reporting_period": { "from": "2026-03-08T00:00:00Z", "to": "2026-03-15T00:00:00Z" },
    "constitutional_compliance": [
      { "article": "asimov.constitution.md Article 0", "status": "compliant" },
      { "article": "default.constitution.md Article 1", "status": "compliant" }
    ],
    "policy_compliance": [
      { "policy": "alignment-policy.yaml", "status": "compliant" }
    ],
    "violations": [],
    "overall_status": "compliant",
    "reported_at": "2026-03-15T20:00:00Z"
  },
  "adapter": "neo4j-governance-adapter",
  "synced_at": "2026-03-15T20:05:00Z",
  "channel": "crisp"
}
